{
  "iss": "gatelm-chat-api",
  "aud": "gatelm-gateway-tenant-chat",
  "sub": "service:chat-api",
  "jti": "jti_fixture_001",
  "iat": 1783828800,
  "nbf": 1783828795,
  "exp": 1783828830,
  "phase": "completion",
  "requestId": "request_fixture_001",
  "turnId": "turn_fixture_001",
  "idempotencyKey": "turn_fixture_001_attempt_1",
  "tenantId": "tenant_fixture_001",
  "userId": "user_fixture_001",
  "actorKind": "employee",
  "employeeId": "employee_fixture_001",
  "actorAuthzVersion": 4,
  "tenantAuthzVersion": 7,
  "sessionVersion": 3,
  "snapshotVersion": 12,
  "snapshotDigest": "sha256:fixtureSnapshotDigest001",
  "bindingDigest": "hmac-sha256:fixtureBindingDigest001",
  "admissionId": "admission_fixture_001"
}
